{
  "schema": "screen-writing/v0.1",
  "packet_id": "synthetic-packet-1",
  "intent": "highlight_parameter",
  "context": {
    "lab_session_id": "synthetic-lab-session",
    "experiment_id": "PR-AM-DSB",
    "checkpoint_id": "CP-DSB-03",
    "visit_id": "synthetic-visit-3",
    "lab_revision": 7,
    "workspace_id": "synthetic-simulink-model",
    "capture_epoch": 1,
    "parameter_revision": 2,
    "condition": "baseline"
  },
  "evidence": {
    "observation_id": "synthetic-observation-7",
    "frame_id": "synthetic-frame-7",
    "sha256": "0000000000000000000000000000000000000000000000000000000000000000",
    "received_at": "2026-10-14T00:30:00+05:30",
    "encoded_width": 1280,
    "encoded_height": 720
  },
  "target": {
    "semantic_label": "Message Sine Wave frequency field",
    "resolution": "resolved",
    "region": {
      "x": 0.25,
      "y": 0.3,
      "width": 0.3,
      "height": 0.06
    }
  },
  "render": {
    "surface": "captured_frame",
    "coordinate_space": "normalized_encoded_frame",
    "pointer_events": "none",
    "colour_semantics": "concept=green,words=red,english=yellow,lab=blue",
    "clip_to_frame": true
  },
  "validity": {
    "created_at": "2026-10-14T00:30:01+05:30",
    "expires_at": "2026-10-14T00:30:09+05:30",
    "max_frame_age_ms": 20000,
    "invalidate_on": [
      "workspace_change",
      "capture_epoch_change",
      "step_visit_change",
      "parameter_revision_change",
      "scroll",
      "zoom",
      "resize",
      "canvas_pan",
      "modal_change",
      "disconnect"
    ]
  },
  "operations": [
    {
      "kind": "box",
      "cue_id": "synthetic-cue-1",
      "layer_id": "guidance",
      "meaning": "lab",
      "accessible_label": "Message frequency field",
      "region": {
        "x": 0.25,
        "y": 0.3,
        "width": 0.3,
        "height": 0.06
      }
    }
  ],
  "fallback": {
    "instruction": "Set Message Frequency to 2*pi*100 rad/s.",
    "on_unresolved": "text_only"
  }
}
